{
  "cosmolang": "0.1",
  "event_sequence": "901",
  "session_id": "session-1",
  "request_id": "example-19",
  "revision": "7",
  "context": {
    "graph": "research-graph",
    "snapshot": "snapshot-42",
    "projection": "projection-v1",
    "hierarchy": "spatial-h1",
    "layout": "layout-v1",
    "selection": null
  },
  "kind": "job.progress",
  "job": {
    "job_id": "job-19",
    "state": "running",
    "cancellation": "cooperative"
  }
}
